{
  "schema_version": 1,
  "contract_id": "ft.agent_mail_outbox_entry.v1",
  "source_bead": "ft-dezx8.1",
  "replay_id": "amq1-57a1e0b00fa11bac1234fedc",
  "created_at": "2026-05-29T13:40:00Z",
  "agent": {
    "name": "IvoryCreek",
    "program": "codex-cli",
    "model": "gpt-5-codex",
    "project_key": "/Users/jemanuel/projects/frankenterm"
  },
  "thread_id": "ft-dezx8.1",
  "recipients": {
    "to": ["SapphireCardinal"],
    "cc": [],
    "bcc": []
  },
  "subject": "ft-dezx8.1 stale owner handoff",
  "body_policy": {
    "body_sha256": "13579bdf2468ace013579bdf2468ace013579bdf2468ace013579bdf2468ace0",
    "body_storage": "digest_only",
    "body_preview_redacted": "Stale-owner handoff notice records candidate ownership checks and avoids dirty-overlap reopen.",
    "body_byte_count": 236,
    "max_retained_bytes": 4096,
    "raw_body_retained": false
  },
  "importance": "normal",
  "ack_required": false,
  "attachments": [],
  "source_operation": "stale_owner_handoff_notice",
  "failure_reason": {
    "class": "database_recovery_notice",
    "summary": "Agent Mail database recovery notice exhausted the allowed retry; handoff stayed in fallback queue.",
    "retry_count": 1,
    "retry_limit": 1,
    "last_attempt_at": "2026-05-29T13:40:10Z"
  },
  "state": "replay_failed",
  "state_reason": null,
  "operator_decision": null,
  "replay_receipt": {
    "dry_run_at": "2026-05-29T13:44:00Z",
    "replayed_at": "2026-05-29T13:45:00Z",
    "delivered_message_id": null,
    "failure_summary": "Replay refused because contact freshness could not be proven without Agent Mail."
  },
  "retention": {
    "retain_until": "2026-06-28T13:40:00Z",
    "automatic_discard": false,
    "redaction": ["body_digest_only", "body_preview_redacted", "attachment_refs_only"]
  },
  "reservation_intent": null,
  "beads_fallback": {
    "bead_id": "ft-dezx8.1",
    "action": "comment_only",
    "comment_sha256": "55556666777788889999aaaabbbbccccddddeeeeffff00001111222233334444",
    "comment_preview_redacted": "Handoff remained a Beads comment because replay proof failed closed."
  }
}
